
*** Running vivado
    with args -log design_1_wrapper.vds -m64 -product Vivado -mode batch -messageDb vivado.pb -notrace -source design_1_wrapper.tcl


****** Vivado v2018.3 (64-bit)
  **** SW Build 2405991 on Thu Dec  6 23:38:27 MST 2018
  **** IP Build 2404404 on Fri Dec  7 01:43:56 MST 2018
    ** Copyright 1986-2018 Xilinx, Inc. All Rights Reserved.

source design_1_wrapper.tcl -notrace
create_project: Time (s): cpu = 00:00:02 ; elapsed = 00:00:11 . Memory (MB): peak = 319.625 ; gain = 70.703
INFO: [IP_Flow 19-234] Refreshing IP repositories
INFO: [IP_Flow 19-1704] No user IP repositories specified
INFO: [IP_Flow 19-2313] Loaded Vivado IP repository 'C:/Xilinx/Vivado/2018.3/data/ip'.
add_files: Time (s): cpu = 00:00:08 ; elapsed = 00:00:56 . Memory (MB): peak = 383.852 ; gain = 64.227
Command: synth_design -top design_1_wrapper -part xc7a100tcsg324-1
Starting synth_design
Attempting to get a license for feature 'Synthesis' and/or device 'xc7a100t'
INFO: [Common 17-349] Got license for feature 'Synthesis' and/or device 'xc7a100t'
INFO: Launching helper process for spawning children vivado processes
INFO: Helper process launched with PID 6824 
---------------------------------------------------------------------------------
Starting RTL Elaboration : Time (s): cpu = 00:00:04 ; elapsed = 00:00:05 . Memory (MB): peak = 497.797 ; gain = 105.949
---------------------------------------------------------------------------------
INFO: [Synth 8-638] synthesizing module 'design_1_wrapper' [D:/aulas/cr/projects/projecto/SortWeights_5/SortWeights_5.srcs/sources_1/imports/hdl/design_1_wrapper.vhd:23]
INFO: [Synth 8-3491] module 'design_1' declared at 'D:/aulas/cr/projects/projecto/SortWeights_5/SortWeights_5.srcs/sources_1/bd/design_1/synth/design_1.vhd:1354' bound to instance 'design_1_i' of component 'design_1' [D:/aulas/cr/projects/projecto/SortWeights_5/SortWeights_5.srcs/sources_1/imports/hdl/design_1_wrapper.vhd:33]
INFO: [Synth 8-638] synthesizing module 'design_1' [D:/aulas/cr/projects/projecto/SortWeights_5/SortWeights_5.srcs/sources_1/bd/design_1/synth/design_1.vhd:1367]
INFO: [Synth 8-3491] module 'design_1_HammingCounter_0_0' declared at 'D:/aulas/cr/projects/projecto/SortWeights_5/SortWeights_5.runs/synth_1/.Xil/Vivado-6068-DESKTOP-UEV5SH3/realtime/design_1_HammingCounter_0_0_stub.vhdl:5' bound to instance 'HammingCounter_0' of component 'design_1_HammingCounter_0_0' [D:/aulas/cr/projects/projecto/SortWeights_5/SortWeights_5.srcs/sources_1/bd/design_1/synth/design_1.vhd:1760]
INFO: [Synth 8-638] synthesizing module 'design_1_HammingCounter_0_0' [D:/aulas/cr/projects/projecto/SortWeights_5/SortWeights_5.runs/synth_1/.Xil/Vivado-6068-DESKTOP-UEV5SH3/realtime/design_1_HammingCounter_0_0_stub.vhdl:15]
INFO: [Synth 8-3491] module 'design_1_IterativeSorter_0_0' declared at 'D:/aulas/cr/projects/projecto/SortWeights_5/SortWeights_5.runs/synth_1/.Xil/Vivado-6068-DESKTOP-UEV5SH3/realtime/design_1_IterativeSorter_0_0_stub.vhdl:5' bound to instance 'IterativeSorter_0' of component 'design_1_IterativeSorter_0_0' [D:/aulas/cr/projects/projecto/SortWeights_5/SortWeights_5.srcs/sources_1/bd/design_1/synth/design_1.vhd:1767]
INFO: [Synth 8-638] synthesizing module 'design_1_IterativeSorter_0_0' [D:/aulas/cr/projects/projecto/SortWeights_5/SortWeights_5.runs/synth_1/.Xil/Vivado-6068-DESKTOP-UEV5SH3/realtime/design_1_IterativeSorter_0_0_stub.vhdl:16]
INFO: [Synth 8-3491] module 'design_1_axi_gpio_0_0' declared at 'D:/aulas/cr/projects/projecto/SortWeights_5/SortWeights_5.runs/synth_1/.Xil/Vivado-6068-DESKTOP-UEV5SH3/realtime/design_1_axi_gpio_0_0_stub.vhdl:5' bound to instance 'axi_gpio_0' of component 'design_1_axi_gpio_0_0' [D:/aulas/cr/projects/projecto/SortWeights_5/SortWeights_5.srcs/sources_1/bd/design_1/synth/design_1.vhd:1775]
INFO: [Synth 8-638] synthesizing module 'design_1_axi_gpio_0_0' [D:/aulas/cr/projects/projecto/SortWeights_5/SortWeights_5.runs/synth_1/.Xil/Vivado-6068-DESKTOP-UEV5SH3/realtime/design_1_axi_gpio_0_0_stub.vhdl:36]
INFO: [Synth 8-3491] module 'design_1_clk_wiz_1_0' declared at 'D:/aulas/cr/projects/projecto/SortWeights_5/SortWeights_5.runs/synth_1/.Xil/Vivado-6068-DESKTOP-UEV5SH3/realtime/design_1_clk_wiz_1_0_stub.vhdl:5' bound to instance 'clk_wiz_1' of component 'design_1_clk_wiz_1_0' [D:/aulas/cr/projects/projecto/SortWeights_5/SortWeights_5.srcs/sources_1/bd/design_1/synth/design_1.vhd:1803]
INFO: [Synth 8-638] synthesizing module 'design_1_clk_wiz_1_0' [D:/aulas/cr/projects/projecto/SortWeights_5/SortWeights_5.runs/synth_1/.Xil/Vivado-6068-DESKTOP-UEV5SH3/realtime/design_1_clk_wiz_1_0_stub.vhdl:13]
INFO: [Synth 8-3491] module 'design_1_dist_mem_gen_0_0' declared at 'D:/aulas/cr/projects/projecto/SortWeights_5/SortWeights_5.runs/synth_1/.Xil/Vivado-6068-DESKTOP-UEV5SH3/realtime/design_1_dist_mem_gen_0_0_stub.vhdl:5' bound to instance 'dist_mem_gen_0' of component 'design_1_dist_mem_gen_0_0' [D:/aulas/cr/projects/projecto/SortWeights_5/SortWeights_5.srcs/sources_1/bd/design_1/synth/design_1.vhd:1808]
INFO: [Synth 8-638] synthesizing module 'design_1_dist_mem_gen_0_0' [D:/aulas/cr/projects/projecto/SortWeights_5/SortWeights_5.runs/synth_1/.Xil/Vivado-6068-DESKTOP-UEV5SH3/realtime/design_1_dist_mem_gen_0_0_stub.vhdl:16]
INFO: [Synth 8-3491] module 'design_1_hw_to_sw_0_0' declared at 'D:/aulas/cr/projects/projecto/SortWeights_5/SortWeights_5.runs/synth_1/.Xil/Vivado-6068-DESKTOP-UEV5SH3/realtime/design_1_hw_to_sw_0_0_stub.vhdl:5' bound to instance 'hw_to_sw_0' of component 'design_1_hw_to_sw_0_0' [D:/aulas/cr/projects/projecto/SortWeights_5/SortWeights_5.srcs/sources_1/bd/design_1/synth/design_1.vhd:1816]
INFO: [Synth 8-638] synthesizing module 'design_1_hw_to_sw_0_0' [D:/aulas/cr/projects/projecto/SortWeights_5/SortWeights_5.runs/synth_1/.Xil/Vivado-6068-DESKTOP-UEV5SH3/realtime/design_1_hw_to_sw_0_0_stub.vhdl:16]
INFO: [Synth 8-3491] module 'design_1_hw_to_sw_0_1' declared at 'D:/aulas/cr/projects/projecto/SortWeights_5/SortWeights_5.runs/synth_1/.Xil/Vivado-6068-DESKTOP-UEV5SH3/realtime/design_1_hw_to_sw_0_1_stub.vhdl:5' bound to instance 'hw_to_sw_1' of component 'design_1_hw_to_sw_0_1' [D:/aulas/cr/projects/projecto/SortWeights_5/SortWeights_5.srcs/sources_1/bd/design_1/synth/design_1.vhd:1824]
INFO: [Synth 8-638] synthesizing module 'design_1_hw_to_sw_0_1' [D:/aulas/cr/projects/projecto/SortWeights_5/SortWeights_5.runs/synth_1/.Xil/Vivado-6068-DESKTOP-UEV5SH3/realtime/design_1_hw_to_sw_0_1_stub.vhdl:16]
INFO: [Synth 8-3491] module 'design_1_mdm_1_0' declared at 'D:/aulas/cr/projects/projecto/SortWeights_5/SortWeights_5.runs/synth_1/.Xil/Vivado-6068-DESKTOP-UEV5SH3/realtime/design_1_mdm_1_0_stub.vhdl:5' bound to instance 'mdm_1' of component 'design_1_mdm_1_0' [D:/aulas/cr/projects/projecto/SortWeights_5/SortWeights_5.srcs/sources_1/bd/design_1/synth/design_1.vhd:1832]
INFO: [Synth 8-638] synthesizing module 'design_1_mdm_1_0' [D:/aulas/cr/projects/projecto/SortWeights_5/SortWeights_5.runs/synth_1/.Xil/Vivado-6068-DESKTOP-UEV5SH3/realtime/design_1_mdm_1_0_stub.vhdl:41]
INFO: [Synth 8-3491] module 'design_1_microblaze_0_0' declared at 'D:/aulas/cr/projects/projecto/SortWeights_5/SortWeights_5.runs/synth_1/.Xil/Vivado-6068-DESKTOP-UEV5SH3/realtime/design_1_microblaze_0_0_stub.vhdl:5' bound to instance 'microblaze_0' of component 'design_1_microblaze_0_0' [D:/aulas/cr/projects/projecto/SortWeights_5/SortWeights_5.srcs/sources_1/bd/design_1/synth/design_1.vhd:1865]
INFO: [Synth 8-638] synthesizing module 'design_1_microblaze_0_0' [D:/aulas/cr/projects/projecto/SortWeights_5/SortWeights_5.runs/synth_1/.Xil/Vivado-6068-DESKTOP-UEV5SH3/realtime/design_1_microblaze_0_0_stub.vhdl:63]
INFO: [Synth 8-638] synthesizing module 'design_1_microblaze_0_axi_periph_0' [D:/aulas/cr/projects/projecto/SortWeights_5/SortWeights_5.srcs/sources_1/bd/design_1/synth/design_1.vhd:951]
INFO: [Synth 8-638] synthesizing module 'm00_couplers_imp_8RVYHO' [D:/aulas/cr/projects/projecto/SortWeights_5/SortWeights_5.srcs/sources_1/bd/design_1/synth/design_1.vhd:57]
INFO: [Synth 8-256] done synthesizing module 'm00_couplers_imp_8RVYHO' (1#1) [D:/aulas/cr/projects/projecto/SortWeights_5/SortWeights_5.srcs/sources_1/bd/design_1/synth/design_1.vhd:57]
INFO: [Synth 8-638] synthesizing module 'm01_couplers_imp_1UTB3Y5' [D:/aulas/cr/projects/projecto/SortWeights_5/SortWeights_5.srcs/sources_1/bd/design_1/synth/design_1.vhd:158]
INFO: [Synth 8-256] done synthesizing module 'm01_couplers_imp_1UTB3Y5' (2#1) [D:/aulas/cr/projects/projecto/SortWeights_5/SortWeights_5.srcs/sources_1/bd/design_1/synth/design_1.vhd:158]
INFO: [Synth 8-638] synthesizing module 's00_couplers_imp_1RZP34U' [D:/aulas/cr/projects/projecto/SortWeights_5/SortWeights_5.srcs/sources_1/bd/design_1/synth/design_1.vhd:821]
INFO: [Synth 8-256] done synthesizing module 's00_couplers_imp_1RZP34U' (3#1) [D:/aulas/cr/projects/projecto/SortWeights_5/SortWeights_5.srcs/sources_1/bd/design_1/synth/design_1.vhd:821]
INFO: [Synth 8-3491] module 'design_1_xbar_0' declared at 'D:/aulas/cr/projects/projecto/SortWeights_5/SortWeights_5.runs/synth_1/.Xil/Vivado-6068-DESKTOP-UEV5SH3/realtime/design_1_xbar_0_stub.vhdl:5' bound to instance 'xbar' of component 'design_1_xbar_0' [D:/aulas/cr/projects/projecto/SortWeights_5/SortWeights_5.srcs/sources_1/bd/design_1/synth/design_1.vhd:1289]
INFO: [Synth 8-638] synthesizing module 'design_1_xbar_0' [D:/aulas/cr/projects/projecto/SortWeights_5/SortWeights_5.runs/synth_1/.Xil/Vivado-6068-DESKTOP-UEV5SH3/realtime/design_1_xbar_0_stub.vhdl:51]
INFO: [Synth 8-256] done synthesizing module 'design_1_microblaze_0_axi_periph_0' (4#1) [D:/aulas/cr/projects/projecto/SortWeights_5/SortWeights_5.srcs/sources_1/bd/design_1/synth/design_1.vhd:951]
INFO: [Synth 8-638] synthesizing module 'microblaze_0_local_memory_imp_1K0VQXK' [D:/aulas/cr/projects/projecto/SortWeights_5/SortWeights_5.srcs/sources_1/bd/design_1/synth/design_1.vhd:242]
INFO: [Synth 8-3491] module 'design_1_dlmb_bram_if_cntlr_0' declared at 'D:/aulas/cr/projects/projecto/SortWeights_5/SortWeights_5.runs/synth_1/.Xil/Vivado-6068-DESKTOP-UEV5SH3/realtime/design_1_dlmb_bram_if_cntlr_0_stub.vhdl:5' bound to instance 'dlmb_bram_if_cntlr' of component 'design_1_dlmb_bram_if_cntlr_0' [D:/aulas/cr/projects/projecto/SortWeights_5/SortWeights_5.srcs/sources_1/bd/design_1/synth/design_1.vhd:456]
INFO: [Synth 8-638] synthesizing module 'design_1_dlmb_bram_if_cntlr_0' [D:/aulas/cr/projects/projecto/SortWeights_5/SortWeights_5.runs/synth_1/.Xil/Vivado-6068-DESKTOP-UEV5SH3/realtime/design_1_dlmb_bram_if_cntlr_0_stub.vhdl:31]
INFO: [Synth 8-3491] module 'design_1_dlmb_v10_0' declared at 'D:/aulas/cr/projects/projecto/SortWeights_5/SortWeights_5.runs/synth_1/.Xil/Vivado-6068-DESKTOP-UEV5SH3/realtime/design_1_dlmb_v10_0_stub.vhdl:5' bound to instance 'dlmb_v10' of component 'design_1_dlmb_v10_0' [D:/aulas/cr/projects/projecto/SortWeights_5/SortWeights_5.srcs/sources_1/bd/design_1/synth/design_1.vhd:510]
INFO: [Synth 8-638] synthesizing module 'design_1_dlmb_v10_0' [D:/aulas/cr/projects/projecto/SortWeights_5/SortWeights_5.runs/synth_1/.Xil/Vivado-6068-DESKTOP-UEV5SH3/realtime/design_1_dlmb_v10_0_stub.vhdl:36]
INFO: [Synth 8-3491] module 'design_1_ilmb_bram_if_cntlr_0' declared at 'D:/aulas/cr/projects/projecto/SortWeights_5/SortWeights_5.runs/synth_1/.Xil/Vivado-6068-DESKTOP-UEV5SH3/realtime/design_1_ilmb_bram_if_cntlr_0_stub.vhdl:5' bound to instance 'ilmb_bram_if_cntlr' of component 'design_1_ilmb_bram_if_cntlr_0' [D:/aulas/cr/projects/projecto/SortWeights_5/SortWeights_5.srcs/sources_1/bd/design_1/synth/design_1.vhd:538]
INFO: [Synth 8-638] synthesizing module 'design_1_ilmb_bram_if_cntlr_0' [D:/aulas/cr/projects/projecto/SortWeights_5/SortWeights_5.runs/synth_1/.Xil/Vivado-6068-DESKTOP-UEV5SH3/realtime/design_1_ilmb_bram_if_cntlr_0_stub.vhdl:31]
INFO: [Synth 8-3491] module 'design_1_ilmb_v10_0' declared at 'D:/aulas/cr/projects/projecto/SortWeights_5/SortWeights_5.runs/synth_1/.Xil/Vivado-6068-DESKTOP-UEV5SH3/realtime/design_1_ilmb_v10_0_stub.vhdl:5' bound to instance 'ilmb_v10' of component 'design_1_ilmb_v10_0' [D:/aulas/cr/projects/projecto/SortWeights_5/SortWeights_5.srcs/sources_1/bd/design_1/synth/design_1.vhd:592]
INFO: [Synth 8-638] synthesizing module 'design_1_ilmb_v10_0' [D:/aulas/cr/projects/projecto/SortWeights_5/SortWeights_5.runs/synth_1/.Xil/Vivado-6068-DESKTOP-UEV5SH3/realtime/design_1_ilmb_v10_0_stub.vhdl:36]
INFO: [Synth 8-3491] module 'design_1_lmb_bram_0' declared at 'D:/aulas/cr/projects/projecto/SortWeights_5/SortWeights_5.runs/synth_1/.Xil/Vivado-6068-DESKTOP-UEV5SH3/realtime/design_1_lmb_bram_0_stub.vhdl:5' bound to instance 'lmb_bram' of component 'design_1_lmb_bram_0' [D:/aulas/cr/projects/projecto/SortWeights_5/SortWeights_5.srcs/sources_1/bd/design_1/synth/design_1.vhd:620]
INFO: [Synth 8-638] synthesizing module 'design_1_lmb_bram_0' [D:/aulas/cr/projects/projecto/SortWeights_5/SortWeights_5.runs/synth_1/.Xil/Vivado-6068-DESKTOP-UEV5SH3/realtime/design_1_lmb_bram_0_stub.vhdl:27]
INFO: [Synth 8-256] done synthesizing module 'microblaze_0_local_memory_imp_1K0VQXK' (5#1) [D:/aulas/cr/projects/projecto/SortWeights_5/SortWeights_5.srcs/sources_1/bd/design_1/synth/design_1.vhd:242]
INFO: [Synth 8-3491] module 'design_1_rst_clk_wiz_1_100M_0' declared at 'D:/aulas/cr/projects/projecto/SortWeights_5/SortWeights_5.runs/synth_1/.Xil/Vivado-6068-DESKTOP-UEV5SH3/realtime/design_1_rst_clk_wiz_1_100M_0_stub.vhdl:5' bound to instance 'rst_clk_wiz_1_100M' of component 'design_1_rst_clk_wiz_1_100M_0' [D:/aulas/cr/projects/projecto/SortWeights_5/SortWeights_5.srcs/sources_1/bd/design_1/synth/design_1.vhd:2008]
INFO: [Synth 8-638] synthesizing module 'design_1_rst_clk_wiz_1_100M_0' [D:/aulas/cr/projects/projecto/SortWeights_5/SortWeights_5.runs/synth_1/.Xil/Vivado-6068-DESKTOP-UEV5SH3/realtime/design_1_rst_clk_wiz_1_100M_0_stub.vhdl:21]
INFO: [Synth 8-3491] module 'design_1_select_in_0_0' declared at 'D:/aulas/cr/projects/projecto/SortWeights_5/SortWeights_5.runs/synth_1/.Xil/Vivado-6068-DESKTOP-UEV5SH3/realtime/design_1_select_in_0_0_stub.vhdl:5' bound to instance 'select_in_0' of component 'design_1_select_in_0_0' [D:/aulas/cr/projects/projecto/SortWeights_5/SortWeights_5.srcs/sources_1/bd/design_1/synth/design_1.vhd:2021]
INFO: [Synth 8-638] synthesizing module 'design_1_select_in_0_0' [D:/aulas/cr/projects/projecto/SortWeights_5/SortWeights_5.runs/synth_1/.Xil/Vivado-6068-DESKTOP-UEV5SH3/realtime/design_1_select_in_0_0_stub.vhdl:15]
INFO: [Synth 8-3491] module 'design_1_select_in_0_1' declared at 'D:/aulas/cr/projects/projecto/SortWeights_5/SortWeights_5.runs/synth_1/.Xil/Vivado-6068-DESKTOP-UEV5SH3/realtime/design_1_select_in_0_1_stub.vhdl:5' bound to instance 'select_in_1' of component 'design_1_select_in_0_1' [D:/aulas/cr/projects/projecto/SortWeights_5/SortWeights_5.srcs/sources_1/bd/design_1/synth/design_1.vhd:2028]
INFO: [Synth 8-638] synthesizing module 'design_1_select_in_0_1' [D:/aulas/cr/projects/projecto/SortWeights_5/SortWeights_5.runs/synth_1/.Xil/Vivado-6068-DESKTOP-UEV5SH3/realtime/design_1_select_in_0_1_stub.vhdl:15]
INFO: [Synth 8-3491] module 'design_1_unroll_mem_0_0' declared at 'D:/aulas/cr/projects/projecto/SortWeights_5/SortWeights_5.runs/synth_1/.Xil/Vivado-6068-DESKTOP-UEV5SH3/realtime/design_1_unroll_mem_0_0_stub.vhdl:5' bound to instance 'unroll_mem_0' of component 'design_1_unroll_mem_0_0' [D:/aulas/cr/projects/projecto/SortWeights_5/SortWeights_5.srcs/sources_1/bd/design_1/synth/design_1.vhd:2035]
INFO: [Synth 8-638] synthesizing module 'design_1_unroll_mem_0_0' [D:/aulas/cr/projects/projecto/SortWeights_5/SortWeights_5.runs/synth_1/.Xil/Vivado-6068-DESKTOP-UEV5SH3/realtime/design_1_unroll_mem_0_0_stub.vhdl:17]
INFO: [Synth 8-3491] module 'design_1_xlslice_0_0' declared at 'd:/aulas/cr/projects/projecto/SortWeights_5/SortWeights_5.srcs/sources_1/bd/design_1/ip/design_1_xlslice_0_0/synth/design_1_xlslice_0_0.v:57' bound to instance 'xlslice_0' of component 'design_1_xlslice_0_0' [D:/aulas/cr/projects/projecto/SortWeights_5/SortWeights_5.srcs/sources_1/bd/design_1/synth/design_1.vhd:2044]
INFO: [Synth 8-6157] synthesizing module 'design_1_xlslice_0_0' [d:/aulas/cr/projects/projecto/SortWeights_5/SortWeights_5.srcs/sources_1/bd/design_1/ip/design_1_xlslice_0_0/synth/design_1_xlslice_0_0.v:57]
INFO: [Synth 8-6157] synthesizing module 'xlslice_v1_0_1_xlslice' [d:/aulas/cr/projects/projecto/SortWeights_5/SortWeights_5.srcs/sources_1/bd/design_1/ipshared/f3db/hdl/xlslice_v1_0_vl_rfs.v:13]
	Parameter DIN_WIDTH bound to: 9 - type: integer 
	Parameter DIN_FROM bound to: 8 - type: integer 
	Parameter DIN_TO bound to: 0 - type: integer 
INFO: [Synth 8-6155] done synthesizing module 'xlslice_v1_0_1_xlslice' (6#1) [d:/aulas/cr/projects/projecto/SortWeights_5/SortWeights_5.srcs/sources_1/bd/design_1/ipshared/f3db/hdl/xlslice_v1_0_vl_rfs.v:13]
INFO: [Synth 8-6155] done synthesizing module 'design_1_xlslice_0_0' (7#1) [d:/aulas/cr/projects/projecto/SortWeights_5/SortWeights_5.srcs/sources_1/bd/design_1/ip/design_1_xlslice_0_0/synth/design_1_xlslice_0_0.v:57]
INFO: [Synth 8-3491] module 'design_1_xlslice_1_0' declared at 'd:/aulas/cr/projects/projecto/SortWeights_5/SortWeights_5.srcs/sources_1/bd/design_1/ip/design_1_xlslice_1_0/synth/design_1_xlslice_1_0.v:57' bound to instance 'xlslice_1' of component 'design_1_xlslice_1_0' [D:/aulas/cr/projects/projecto/SortWeights_5/SortWeights_5.srcs/sources_1/bd/design_1/synth/design_1.vhd:2049]
INFO: [Synth 8-6157] synthesizing module 'design_1_xlslice_1_0' [d:/aulas/cr/projects/projecto/SortWeights_5/SortWeights_5.srcs/sources_1/bd/design_1/ip/design_1_xlslice_1_0/synth/design_1_xlslice_1_0.v:57]
INFO: [Synth 8-6157] synthesizing module 'xlslice_v1_0_1_xlslice__parameterized0' [d:/aulas/cr/projects/projecto/SortWeights_5/SortWeights_5.srcs/sources_1/bd/design_1/ipshared/f3db/hdl/xlslice_v1_0_vl_rfs.v:13]
	Parameter DIN_WIDTH bound to: 32 - type: integer 
	Parameter DIN_FROM bound to: 31 - type: integer 
	Parameter DIN_TO bound to: 31 - type: integer 
INFO: [Synth 8-6155] done synthesizing module 'xlslice_v1_0_1_xlslice__parameterized0' (7#1) [d:/aulas/cr/projects/projecto/SortWeights_5/SortWeights_5.srcs/sources_1/bd/design_1/ipshared/f3db/hdl/xlslice_v1_0_vl_rfs.v:13]
INFO: [Synth 8-6155] done synthesizing module 'design_1_xlslice_1_0' (8#1) [d:/aulas/cr/projects/projecto/SortWeights_5/SortWeights_5.srcs/sources_1/bd/design_1/ip/design_1_xlslice_1_0/synth/design_1_xlslice_1_0.v:57]
INFO: [Synth 8-3491] module 'design_1_xlslice_2_0' declared at 'd:/aulas/cr/projects/projecto/SortWeights_5/SortWeights_5.srcs/sources_1/bd/design_1/ip/design_1_xlslice_2_0/synth/design_1_xlslice_2_0.v:57' bound to instance 'xlslice_2' of component 'design_1_xlslice_2_0' [D:/aulas/cr/projects/projecto/SortWeights_5/SortWeights_5.srcs/sources_1/bd/design_1/synth/design_1.vhd:2054]
INFO: [Synth 8-6157] synthesizing module 'design_1_xlslice_2_0' [d:/aulas/cr/projects/projecto/SortWeights_5/SortWeights_5.srcs/sources_1/bd/design_1/ip/design_1_xlslice_2_0/synth/design_1_xlslice_2_0.v:57]
INFO: [Synth 8-6157] synthesizing module 'xlslice_v1_0_1_xlslice__parameterized1' [d:/aulas/cr/projects/projecto/SortWeights_5/SortWeights_5.srcs/sources_1/bd/design_1/ipshared/f3db/hdl/xlslice_v1_0_vl_rfs.v:13]
	Parameter DIN_WIDTH bound to: 32 - type: integer 
	Parameter DIN_FROM bound to: 23 - type: integer 
	Parameter DIN_TO bound to: 0 - type: integer 
INFO: [Synth 8-6155] done synthesizing module 'xlslice_v1_0_1_xlslice__parameterized1' (8#1) [d:/aulas/cr/projects/projecto/SortWeights_5/SortWeights_5.srcs/sources_1/bd/design_1/ipshared/f3db/hdl/xlslice_v1_0_vl_rfs.v:13]
INFO: [Synth 8-6155] done synthesizing module 'design_1_xlslice_2_0' (9#1) [d:/aulas/cr/projects/projecto/SortWeights_5/SortWeights_5.srcs/sources_1/bd/design_1/ip/design_1_xlslice_2_0/synth/design_1_xlslice_2_0.v:57]
INFO: [Synth 8-3491] module 'design_1_xlslice_3_0' declared at 'd:/aulas/cr/projects/projecto/SortWeights_5/SortWeights_5.srcs/sources_1/bd/design_1/ip/design_1_xlslice_3_0/synth/design_1_xlslice_3_0.v:57' bound to instance 'xlslice_3' of component 'design_1_xlslice_3_0' [D:/aulas/cr/projects/projecto/SortWeights_5/SortWeights_5.srcs/sources_1/bd/design_1/synth/design_1.vhd:2059]
INFO: [Synth 8-6157] synthesizing module 'design_1_xlslice_3_0' [d:/aulas/cr/projects/projecto/SortWeights_5/SortWeights_5.srcs/sources_1/bd/design_1/ip/design_1_xlslice_3_0/synth/design_1_xlslice_3_0.v:57]
INFO: [Synth 8-6157] synthesizing module 'xlslice_v1_0_1_xlslice__parameterized2' [d:/aulas/cr/projects/projecto/SortWeights_5/SortWeights_5.srcs/sources_1/bd/design_1/ipshared/f3db/hdl/xlslice_v1_0_vl_rfs.v:13]
	Parameter DIN_WIDTH bound to: 32 - type: integer 
	Parameter DIN_FROM bound to: 30 - type: integer 
	Parameter DIN_TO bound to: 24 - type: integer 
INFO: [Synth 8-6155] done synthesizing module 'xlslice_v1_0_1_xlslice__parameterized2' (9#1) [d:/aulas/cr/projects/projecto/SortWeights_5/SortWeights_5.srcs/sources_1/bd/design_1/ipshared/f3db/hdl/xlslice_v1_0_vl_rfs.v:13]
INFO: [Synth 8-6155] done synthesizing module 'design_1_xlslice_3_0' (10#1) [d:/aulas/cr/projects/projecto/SortWeights_5/SortWeights_5.srcs/sources_1/bd/design_1/ip/design_1_xlslice_3_0/synth/design_1_xlslice_3_0.v:57]
INFO: [Synth 8-3491] module 'design_1_xlslice_4_0' declared at 'd:/aulas/cr/projects/projecto/SortWeights_5/SortWeights_5.srcs/sources_1/bd/design_1/ip/design_1_xlslice_4_0/synth/design_1_xlslice_4_0.v:57' bound to instance 'xlslice_4' of component 'design_1_xlslice_4_0' [D:/aulas/cr/projects/projecto/SortWeights_5/SortWeights_5.srcs/sources_1/bd/design_1/synth/design_1.vhd:2064]
INFO: [Synth 8-6157] synthesizing module 'design_1_xlslice_4_0' [d:/aulas/cr/projects/projecto/SortWeights_5/SortWeights_5.srcs/sources_1/bd/design_1/ip/design_1_xlslice_4_0/synth/design_1_xlslice_4_0.v:57]
INFO: [Synth 8-6157] synthesizing module 'xlslice_v1_0_1_xlslice__parameterized3' [d:/aulas/cr/projects/projecto/SortWeights_5/SortWeights_5.srcs/sources_1/bd/design_1/ipshared/f3db/hdl/xlslice_v1_0_vl_rfs.v:13]
	Parameter DIN_WIDTH bound to: 16 - type: integer 
	Parameter DIN_FROM bound to: 6 - type: integer 
	Parameter DIN_TO bound to: 0 - type: integer 
INFO: [Synth 8-6155] done synthesizing module 'xlslice_v1_0_1_xlslice__parameterized3' (10#1) [d:/aulas/cr/projects/projecto/SortWeights_5/SortWeights_5.srcs/sources_1/bd/design_1/ipshared/f3db/hdl/xlslice_v1_0_vl_rfs.v:13]
INFO: [Synth 8-6155] done synthesizing module 'design_1_xlslice_4_0' (11#1) [d:/aulas/cr/projects/projecto/SortWeights_5/SortWeights_5.srcs/sources_1/bd/design_1/ip/design_1_xlslice_4_0/synth/design_1_xlslice_4_0.v:57]
INFO: [Synth 8-3491] module 'design_1_xlslice_5_0' declared at 'd:/aulas/cr/projects/projecto/SortWeights_5/SortWeights_5.srcs/sources_1/bd/design_1/ip/design_1_xlslice_5_0/synth/design_1_xlslice_5_0.v:57' bound to instance 'xlslice_5' of component 'design_1_xlslice_5_0' [D:/aulas/cr/projects/projecto/SortWeights_5/SortWeights_5.srcs/sources_1/bd/design_1/synth/design_1.vhd:2069]
INFO: [Synth 8-6157] synthesizing module 'design_1_xlslice_5_0' [d:/aulas/cr/projects/projecto/SortWeights_5/SortWeights_5.srcs/sources_1/bd/design_1/ip/design_1_xlslice_5_0/synth/design_1_xlslice_5_0.v:57]
INFO: [Synth 8-6157] synthesizing module 'xlslice_v1_0_1_xlslice__parameterized4' [d:/aulas/cr/projects/projecto/SortWeights_5/SortWeights_5.srcs/sources_1/bd/design_1/ipshared/f3db/hdl/xlslice_v1_0_vl_rfs.v:13]
	Parameter DIN_WIDTH bound to: 3071 - type: integer 
	Parameter DIN_FROM bound to: 2399 - type: integer 
	Parameter DIN_TO bound to: 0 - type: integer 
INFO: [Synth 8-6155] done synthesizing module 'xlslice_v1_0_1_xlslice__parameterized4' (11#1) [d:/aulas/cr/projects/projecto/SortWeights_5/SortWeights_5.srcs/sources_1/bd/design_1/ipshared/f3db/hdl/xlslice_v1_0_vl_rfs.v:13]
INFO: [Synth 8-6155] done synthesizing module 'design_1_xlslice_5_0' (12#1) [d:/aulas/cr/projects/projecto/SortWeights_5/SortWeights_5.srcs/sources_1/bd/design_1/ip/design_1_xlslice_5_0/synth/design_1_xlslice_5_0.v:57]
INFO: [Synth 8-3491] module 'design_1_xlslice_6_0' declared at 'd:/aulas/cr/projects/projecto/SortWeights_5/SortWeights_5.srcs/sources_1/bd/design_1/ip/design_1_xlslice_6_0/synth/design_1_xlslice_6_0.v:57' bound to instance 'xlslice_6' of component 'design_1_xlslice_6_0' [D:/aulas/cr/projects/projecto/SortWeights_5/SortWeights_5.srcs/sources_1/bd/design_1/synth/design_1.vhd:2074]
INFO: [Synth 8-6157] synthesizing module 'design_1_xlslice_6_0' [d:/aulas/cr/projects/projecto/SortWeights_5/SortWeights_5.srcs/sources_1/bd/design_1/ip/design_1_xlslice_6_0/synth/design_1_xlslice_6_0.v:57]
INFO: [Synth 8-6157] synthesizing module 'xlslice_v1_0_1_xlslice__parameterized5' [d:/aulas/cr/projects/projecto/SortWeights_5/SortWeights_5.srcs/sources_1/bd/design_1/ipshared/f3db/hdl/xlslice_v1_0_vl_rfs.v:13]
	Parameter DIN_WIDTH bound to: 500 - type: integer 
	Parameter DIN_FROM bound to: 4 - type: integer 
	Parameter DIN_TO bound to: 0 - type: integer 
INFO: [Synth 8-6155] done synthesizing module 'xlslice_v1_0_1_xlslice__parameterized5' (12#1) [d:/aulas/cr/projects/projecto/SortWeights_5/SortWeights_5.srcs/sources_1/bd/design_1/ipshared/f3db/hdl/xlslice_v1_0_vl_rfs.v:13]
INFO: [Synth 8-6155] done synthesizing module 'design_1_xlslice_6_0' (13#1) [d:/aulas/cr/projects/projecto/SortWeights_5/SortWeights_5.srcs/sources_1/bd/design_1/ip/design_1_xlslice_6_0/synth/design_1_xlslice_6_0.v:57]
INFO: [Synth 8-3491] module 'design_1_xlslice_7_1' declared at 'd:/aulas/cr/projects/projecto/SortWeights_5/SortWeights_5.srcs/sources_1/bd/design_1/ip/design_1_xlslice_7_1/synth/design_1_xlslice_7_1.v:57' bound to instance 'xlslice_7' of component 'design_1_xlslice_7_1' [D:/aulas/cr/projects/projecto/SortWeights_5/SortWeights_5.srcs/sources_1/bd/design_1/synth/design_1.vhd:2079]
INFO: [Synth 8-6157] synthesizing module 'design_1_xlslice_7_1' [d:/aulas/cr/projects/projecto/SortWeights_5/SortWeights_5.srcs/sources_1/bd/design_1/ip/design_1_xlslice_7_1/synth/design_1_xlslice_7_1.v:57]
INFO: [Synth 8-6157] synthesizing module 'xlslice_v1_0_1_xlslice__parameterized6' [d:/aulas/cr/projects/projecto/SortWeights_5/SortWeights_5.srcs/sources_1/bd/design_1/ipshared/f3db/hdl/xlslice_v1_0_vl_rfs.v:13]
	Parameter DIN_WIDTH bound to: 8 - type: integer 
	Parameter DIN_FROM bound to: 7 - type: integer 
	Parameter DIN_TO bound to: 7 - type: integer 
INFO: [Synth 8-6155] done synthesizing module 'xlslice_v1_0_1_xlslice__parameterized6' (13#1) [d:/aulas/cr/projects/projecto/SortWeights_5/SortWeights_5.srcs/sources_1/bd/design_1/ipshared/f3db/hdl/xlslice_v1_0_vl_rfs.v:13]
INFO: [Synth 8-6155] done synthesizing module 'design_1_xlslice_7_1' (14#1) [d:/aulas/cr/projects/projecto/SortWeights_5/SortWeights_5.srcs/sources_1/bd/design_1/ip/design_1_xlslice_7_1/synth/design_1_xlslice_7_1.v:57]
INFO: [Synth 8-3491] module 'design_1_xlslice_8_0' declared at 'd:/aulas/cr/projects/projecto/SortWeights_5/SortWeights_5.srcs/sources_1/bd/design_1/ip/design_1_xlslice_8_0/synth/design_1_xlslice_8_0.v:57' bound to instance 'xlslice_8' of component 'design_1_xlslice_8_0' [D:/aulas/cr/projects/projecto/SortWeights_5/SortWeights_5.srcs/sources_1/bd/design_1/synth/design_1.vhd:2084]
INFO: [Synth 8-6157] synthesizing module 'design_1_xlslice_8_0' [d:/aulas/cr/projects/projecto/SortWeights_5/SortWeights_5.srcs/sources_1/bd/design_1/ip/design_1_xlslice_8_0/synth/design_1_xlslice_8_0.v:57]
INFO: [Synth 8-6157] synthesizing module 'xlslice_v1_0_1_xlslice__parameterized7' [d:/aulas/cr/projects/projecto/SortWeights_5/SortWeights_5.srcs/sources_1/bd/design_1/ipshared/f3db/hdl/xlslice_v1_0_vl_rfs.v:13]
	Parameter DIN_WIDTH bound to: 8 - type: integer 
	Parameter DIN_FROM bound to: 6 - type: integer 
	Parameter DIN_TO bound to: 0 - type: integer 
INFO: [Synth 8-6155] done synthesizing module 'xlslice_v1_0_1_xlslice__parameterized7' (14#1) [d:/aulas/cr/projects/projecto/SortWeights_5/SortWeights_5.srcs/sources_1/bd/design_1/ipshared/f3db/hdl/xlslice_v1_0_vl_rfs.v:13]
INFO: [Synth 8-6155] done synthesizing module 'design_1_xlslice_8_0' (15#1) [d:/aulas/cr/projects/projecto/SortWeights_5/SortWeights_5.srcs/sources_1/bd/design_1/ip/design_1_xlslice_8_0/synth/design_1_xlslice_8_0.v:57]
INFO: [Synth 8-256] done synthesizing module 'design_1' (16#1) [D:/aulas/cr/projects/projecto/SortWeights_5/SortWeights_5.srcs/sources_1/bd/design_1/synth/design_1.vhd:1367]
INFO: [Synth 8-256] done synthesizing module 'design_1_wrapper' (17#1) [D:/aulas/cr/projects/projecto/SortWeights_5/SortWeights_5.srcs/sources_1/imports/hdl/design_1_wrapper.vhd:23]
WARNING: [Synth 8-3331] design xlslice_v1_0_1_xlslice__parameterized7 has unconnected port Din[7]
WARNING: [Synth 8-3331] design xlslice_v1_0_1_xlslice__parameterized6 has unconnected port Din[6]
WARNING: [Synth 8-3331] design xlslice_v1_0_1_xlslice__parameterized6 has unconnected port Din[5]
WARNING: [Synth 8-3331] design xlslice_v1_0_1_xlslice__parameterized6 has unconnected port Din[4]
WARNING: [Synth 8-3331] design xlslice_v1_0_1_xlslice__parameterized6 has unconnected port Din[3]
WARNING: [Synth 8-3331] design xlslice_v1_0_1_xlslice__parameterized6 has unconnected port Din[2]
WARNING: [Synth 8-3331] design xlslice_v1_0_1_xlslice__parameterized6 has unconnected port Din[1]
WARNING: [Synth 8-3331] design xlslice_v1_0_1_xlslice__parameterized6 has unconnected port Din[0]
WARNING: [Synth 8-3331] design xlslice_v1_0_1_xlslice__parameterized5 has unconnected port Din[499]
WARNING: [Synth 8-3331] design xlslice_v1_0_1_xlslice__parameterized5 has unconnected port Din[498]
WARNING: [Synth 8-3331] design xlslice_v1_0_1_xlslice__parameterized5 has unconnected port Din[497]
WARNING: [Synth 8-3331] design xlslice_v1_0_1_xlslice__parameterized5 has unconnected port Din[496]
WARNING: [Synth 8-3331] design xlslice_v1_0_1_xlslice__parameterized5 has unconnected port Din[495]
WARNING: [Synth 8-3331] design xlslice_v1_0_1_xlslice__parameterized5 has unconnected port Din[494]
WARNING: [Synth 8-3331] design xlslice_v1_0_1_xlslice__parameterized5 has unconnected port Din[493]
WARNING: [Synth 8-3331] design xlslice_v1_0_1_xlslice__parameterized5 has unconnected port Din[492]
WARNING: [Synth 8-3331] design xlslice_v1_0_1_xlslice__parameterized5 has unconnected port Din[491]
WARNING: [Synth 8-3331] design xlslice_v1_0_1_xlslice__parameterized5 has unconnected port Din[490]
WARNING: [Synth 8-3331] design xlslice_v1_0_1_xlslice__parameterized5 has unconnected port Din[489]
WARNING: [Synth 8-3331] design xlslice_v1_0_1_xlslice__parameterized5 has unconnected port Din[488]
WARNING: [Synth 8-3331] design xlslice_v1_0_1_xlslice__parameterized5 has unconnected port Din[487]
WARNING: [Synth 8-3331] design xlslice_v1_0_1_xlslice__parameterized5 has unconnected port Din[486]
WARNING: [Synth 8-3331] design xlslice_v1_0_1_xlslice__parameterized5 has unconnected port Din[485]
WARNING: [Synth 8-3331] design xlslice_v1_0_1_xlslice__parameterized5 has unconnected port Din[484]
WARNING: [Synth 8-3331] design xlslice_v1_0_1_xlslice__parameterized5 has unconnected port Din[483]
WARNING: [Synth 8-3331] design xlslice_v1_0_1_xlslice__parameterized5 has unconnected port Din[482]
WARNING: [Synth 8-3331] design xlslice_v1_0_1_xlslice__parameterized5 has unconnected port Din[481]
WARNING: [Synth 8-3331] design xlslice_v1_0_1_xlslice__parameterized5 has unconnected port Din[480]
WARNING: [Synth 8-3331] design xlslice_v1_0_1_xlslice__parameterized5 has unconnected port Din[479]
WARNING: [Synth 8-3331] design xlslice_v1_0_1_xlslice__parameterized5 has unconnected port Din[478]
WARNING: [Synth 8-3331] design xlslice_v1_0_1_xlslice__parameterized5 has unconnected port Din[477]
WARNING: [Synth 8-3331] design xlslice_v1_0_1_xlslice__parameterized5 has unconnected port Din[476]
WARNING: [Synth 8-3331] design xlslice_v1_0_1_xlslice__parameterized5 has unconnected port Din[475]
WARNING: [Synth 8-3331] design xlslice_v1_0_1_xlslice__parameterized5 has unconnected port Din[474]
WARNING: [Synth 8-3331] design xlslice_v1_0_1_xlslice__parameterized5 has unconnected port Din[473]
WARNING: [Synth 8-3331] design xlslice_v1_0_1_xlslice__parameterized5 has unconnected port Din[472]
WARNING: [Synth 8-3331] design xlslice_v1_0_1_xlslice__parameterized5 has unconnected port Din[471]
WARNING: [Synth 8-3331] design xlslice_v1_0_1_xlslice__parameterized5 has unconnected port Din[470]
WARNING: [Synth 8-3331] design xlslice_v1_0_1_xlslice__parameterized5 has unconnected port Din[469]
WARNING: [Synth 8-3331] design xlslice_v1_0_1_xlslice__parameterized5 has unconnected port Din[468]
WARNING: [Synth 8-3331] design xlslice_v1_0_1_xlslice__parameterized5 has unconnected port Din[467]
WARNING: [Synth 8-3331] design xlslice_v1_0_1_xlslice__parameterized5 has unconnected port Din[466]
WARNING: [Synth 8-3331] design xlslice_v1_0_1_xlslice__parameterized5 has unconnected port Din[465]
WARNING: [Synth 8-3331] design xlslice_v1_0_1_xlslice__parameterized5 has unconnected port Din[464]
WARNING: [Synth 8-3331] design xlslice_v1_0_1_xlslice__parameterized5 has unconnected port Din[463]
WARNING: [Synth 8-3331] design xlslice_v1_0_1_xlslice__parameterized5 has unconnected port Din[462]
WARNING: [Synth 8-3331] design xlslice_v1_0_1_xlslice__parameterized5 has unconnected port Din[461]
WARNING: [Synth 8-3331] design xlslice_v1_0_1_xlslice__parameterized5 has unconnected port Din[460]
WARNING: [Synth 8-3331] design xlslice_v1_0_1_xlslice__parameterized5 has unconnected port Din[459]
WARNING: [Synth 8-3331] design xlslice_v1_0_1_xlslice__parameterized5 has unconnected port Din[458]
WARNING: [Synth 8-3331] design xlslice_v1_0_1_xlslice__parameterized5 has unconnected port Din[457]
WARNING: [Synth 8-3331] design xlslice_v1_0_1_xlslice__parameterized5 has unconnected port Din[456]
WARNING: [Synth 8-3331] design xlslice_v1_0_1_xlslice__parameterized5 has unconnected port Din[455]
WARNING: [Synth 8-3331] design xlslice_v1_0_1_xlslice__parameterized5 has unconnected port Din[454]
WARNING: [Synth 8-3331] design xlslice_v1_0_1_xlslice__parameterized5 has unconnected port Din[453]
WARNING: [Synth 8-3331] design xlslice_v1_0_1_xlslice__parameterized5 has unconnected port Din[452]
WARNING: [Synth 8-3331] design xlslice_v1_0_1_xlslice__parameterized5 has unconnected port Din[451]
WARNING: [Synth 8-3331] design xlslice_v1_0_1_xlslice__parameterized5 has unconnected port Din[450]
WARNING: [Synth 8-3331] design xlslice_v1_0_1_xlslice__parameterized5 has unconnected port Din[449]
WARNING: [Synth 8-3331] design xlslice_v1_0_1_xlslice__parameterized5 has unconnected port Din[448]
WARNING: [Synth 8-3331] design xlslice_v1_0_1_xlslice__parameterized5 has unconnected port Din[447]
WARNING: [Synth 8-3331] design xlslice_v1_0_1_xlslice__parameterized5 has unconnected port Din[446]
WARNING: [Synth 8-3331] design xlslice_v1_0_1_xlslice__parameterized5 has unconnected port Din[445]
WARNING: [Synth 8-3331] design xlslice_v1_0_1_xlslice__parameterized5 has unconnected port Din[444]
WARNING: [Synth 8-3331] design xlslice_v1_0_1_xlslice__parameterized5 has unconnected port Din[443]
WARNING: [Synth 8-3331] design xlslice_v1_0_1_xlslice__parameterized5 has unconnected port Din[442]
WARNING: [Synth 8-3331] design xlslice_v1_0_1_xlslice__parameterized5 has unconnected port Din[441]
WARNING: [Synth 8-3331] design xlslice_v1_0_1_xlslice__parameterized5 has unconnected port Din[440]
WARNING: [Synth 8-3331] design xlslice_v1_0_1_xlslice__parameterized5 has unconnected port Din[439]
WARNING: [Synth 8-3331] design xlslice_v1_0_1_xlslice__parameterized5 has unconnected port Din[438]
WARNING: [Synth 8-3331] design xlslice_v1_0_1_xlslice__parameterized5 has unconnected port Din[437]
WARNING: [Synth 8-3331] design xlslice_v1_0_1_xlslice__parameterized5 has unconnected port Din[436]
WARNING: [Synth 8-3331] design xlslice_v1_0_1_xlslice__parameterized5 has unconnected port Din[435]
WARNING: [Synth 8-3331] design xlslice_v1_0_1_xlslice__parameterized5 has unconnected port Din[434]
WARNING: [Synth 8-3331] design xlslice_v1_0_1_xlslice__parameterized5 has unconnected port Din[433]
WARNING: [Synth 8-3331] design xlslice_v1_0_1_xlslice__parameterized5 has unconnected port Din[432]
WARNING: [Synth 8-3331] design xlslice_v1_0_1_xlslice__parameterized5 has unconnected port Din[431]
WARNING: [Synth 8-3331] design xlslice_v1_0_1_xlslice__parameterized5 has unconnected port Din[430]
WARNING: [Synth 8-3331] design xlslice_v1_0_1_xlslice__parameterized5 has unconnected port Din[429]
WARNING: [Synth 8-3331] design xlslice_v1_0_1_xlslice__parameterized5 has unconnected port Din[428]
WARNING: [Synth 8-3331] design xlslice_v1_0_1_xlslice__parameterized5 has unconnected port Din[427]
WARNING: [Synth 8-3331] design xlslice_v1_0_1_xlslice__parameterized5 has unconnected port Din[426]
WARNING: [Synth 8-3331] design xlslice_v1_0_1_xlslice__parameterized5 has unconnected port Din[425]
WARNING: [Synth 8-3331] design xlslice_v1_0_1_xlslice__parameterized5 has unconnected port Din[424]
WARNING: [Synth 8-3331] design xlslice_v1_0_1_xlslice__parameterized5 has unconnected port Din[423]
WARNING: [Synth 8-3331] design xlslice_v1_0_1_xlslice__parameterized5 has unconnected port Din[422]
WARNING: [Synth 8-3331] design xlslice_v1_0_1_xlslice__parameterized5 has unconnected port Din[421]
WARNING: [Synth 8-3331] design xlslice_v1_0_1_xlslice__parameterized5 has unconnected port Din[420]
WARNING: [Synth 8-3331] design xlslice_v1_0_1_xlslice__parameterized5 has unconnected port Din[419]
WARNING: [Synth 8-3331] design xlslice_v1_0_1_xlslice__parameterized5 has unconnected port Din[418]
WARNING: [Synth 8-3331] design xlslice_v1_0_1_xlslice__parameterized5 has unconnected port Din[417]
WARNING: [Synth 8-3331] design xlslice_v1_0_1_xlslice__parameterized5 has unconnected port Din[416]
WARNING: [Synth 8-3331] design xlslice_v1_0_1_xlslice__parameterized5 has unconnected port Din[415]
WARNING: [Synth 8-3331] design xlslice_v1_0_1_xlslice__parameterized5 has unconnected port Din[414]
WARNING: [Synth 8-3331] design xlslice_v1_0_1_xlslice__parameterized5 has unconnected port Din[413]
WARNING: [Synth 8-3331] design xlslice_v1_0_1_xlslice__parameterized5 has unconnected port Din[412]
WARNING: [Synth 8-3331] design xlslice_v1_0_1_xlslice__parameterized5 has unconnected port Din[411]
WARNING: [Synth 8-3331] design xlslice_v1_0_1_xlslice__parameterized5 has unconnected port Din[410]
WARNING: [Synth 8-3331] design xlslice_v1_0_1_xlslice__parameterized5 has unconnected port Din[409]
WARNING: [Synth 8-3331] design xlslice_v1_0_1_xlslice__parameterized5 has unconnected port Din[408]
INFO: [Common 17-14] Message 'Synth 8-3331' appears 100 times and further instances of the messages will be disabled. Use the Tcl command set_msg_config to change the current settings.
---------------------------------------------------------------------------------
Finished RTL Elaboration : Time (s): cpu = 00:00:06 ; elapsed = 00:00:07 . Memory (MB): peak = 555.758 ; gain = 163.910
---------------------------------------------------------------------------------

Report Check Netlist: 
+------+------------------+-------+---------+-------+------------------+
|      |Item              |Errors |Warnings |Status |Description       |
+------+------------------+-------+---------+-------+------------------+
|1     |multi_driven_nets |      0|        0|Passed |Multi driven nets |
+------+------------------+-------+---------+-------+------------------+
---------------------------------------------------------------------------------
Start Handling Custom Attributes
---------------------------------------------------------------------------------
---------------------------------------------------------------------------------
Finished Handling Custom Attributes : Time (s): cpu = 00:00:06 ; elapsed = 00:00:08 . Memory (MB): peak = 555.758 ; gain = 163.910
---------------------------------------------------------------------------------
---------------------------------------------------------------------------------
Finished RTL Optimization Phase 1 : Time (s): cpu = 00:00:06 ; elapsed = 00:00:08 . Memory (MB): peak = 555.758 ; gain = 163.910
---------------------------------------------------------------------------------
INFO: [Device 21-403] Loading part xc7a100tcsg324-1
INFO: [Project 1-570] Preparing netlist for logic optimization

Processing XDC Constraints
Initializing timing engine
Parsing XDC File [d:/aulas/cr/projects/projecto/SortWeights_5/SortWeights_5.srcs/sources_1/bd/design_1/ip/design_1_microblaze_0_0/design_1_microblaze_0_0/design_1_microblaze_0_0_in_context.xdc] for cell 'design_1_i/microblaze_0'
Finished Parsing XDC File [d:/aulas/cr/projects/projecto/SortWeights_5/SortWeights_5.srcs/sources_1/bd/design_1/ip/design_1_microblaze_0_0/design_1_microblaze_0_0/design_1_microblaze_0_0_in_context.xdc] for cell 'design_1_i/microblaze_0'
Parsing XDC File [d:/aulas/cr/projects/projecto/SortWeights_5/SortWeights_5.srcs/sources_1/bd/design_1/ip/design_1_dlmb_v10_0/design_1_dlmb_v10_0/design_1_dlmb_v10_0_in_context.xdc] for cell 'design_1_i/microblaze_0_local_memory/dlmb_v10'
Finished Parsing XDC File [d:/aulas/cr/projects/projecto/SortWeights_5/SortWeights_5.srcs/sources_1/bd/design_1/ip/design_1_dlmb_v10_0/design_1_dlmb_v10_0/design_1_dlmb_v10_0_in_context.xdc] for cell 'design_1_i/microblaze_0_local_memory/dlmb_v10'
Parsing XDC File [d:/aulas/cr/projects/projecto/SortWeights_5/SortWeights_5.srcs/sources_1/bd/design_1/ip/design_1_ilmb_v10_0/design_1_ilmb_v10_0/design_1_dlmb_v10_0_in_context.xdc] for cell 'design_1_i/microblaze_0_local_memory/ilmb_v10'
Finished Parsing XDC File [d:/aulas/cr/projects/projecto/SortWeights_5/SortWeights_5.srcs/sources_1/bd/design_1/ip/design_1_ilmb_v10_0/design_1_ilmb_v10_0/design_1_dlmb_v10_0_in_context.xdc] for cell 'design_1_i/microblaze_0_local_memory/ilmb_v10'
Parsing XDC File [d:/aulas/cr/projects/projecto/SortWeights_5/SortWeights_5.srcs/sources_1/bd/design_1/ip/design_1_dlmb_bram_if_cntlr_0/design_1_dlmb_bram_if_cntlr_0/design_1_dlmb_bram_if_cntlr_0_in_context.xdc] for cell 'design_1_i/microblaze_0_local_memory/dlmb_bram_if_cntlr'
Finished Parsing XDC File [d:/aulas/cr/projects/projecto/SortWeights_5/SortWeights_5.srcs/sources_1/bd/design_1/ip/design_1_dlmb_bram_if_cntlr_0/design_1_dlmb_bram_if_cntlr_0/design_1_dlmb_bram_if_cntlr_0_in_context.xdc] for cell 'design_1_i/microblaze_0_local_memory/dlmb_bram_if_cntlr'
Parsing XDC File [d:/aulas/cr/projects/projecto/SortWeights_5/SortWeights_5.srcs/sources_1/bd/design_1/ip/design_1_ilmb_bram_if_cntlr_0/design_1_ilmb_bram_if_cntlr_0/design_1_ilmb_bram_if_cntlr_0_in_context.xdc] for cell 'design_1_i/microblaze_0_local_memory/ilmb_bram_if_cntlr'
Finished Parsing XDC File [d:/aulas/cr/projects/projecto/SortWeights_5/SortWeights_5.srcs/sources_1/bd/design_1/ip/design_1_ilmb_bram_if_cntlr_0/design_1_ilmb_bram_if_cntlr_0/design_1_ilmb_bram_if_cntlr_0_in_context.xdc] for cell 'design_1_i/microblaze_0_local_memory/ilmb_bram_if_cntlr'
Parsing XDC File [d:/aulas/cr/projects/projecto/SortWeights_5/SortWeights_5.srcs/sources_1/bd/design_1/ip/design_1_lmb_bram_0/design_1_lmb_bram_0/design_1_lmb_bram_0_in_context.xdc] for cell 'design_1_i/microblaze_0_local_memory/lmb_bram'
Finished Parsing XDC File [d:/aulas/cr/projects/projecto/SortWeights_5/SortWeights_5.srcs/sources_1/bd/design_1/ip/design_1_lmb_bram_0/design_1_lmb_bram_0/design_1_lmb_bram_0_in_context.xdc] for cell 'design_1_i/microblaze_0_local_memory/lmb_bram'
Parsing XDC File [d:/aulas/cr/projects/projecto/SortWeights_5/SortWeights_5.srcs/sources_1/bd/design_1/ip/design_1_xbar_0/design_1_xbar_0/design_1_xbar_0_in_context.xdc] for cell 'design_1_i/microblaze_0_axi_periph/xbar'
Finished Parsing XDC File [d:/aulas/cr/projects/projecto/SortWeights_5/SortWeights_5.srcs/sources_1/bd/design_1/ip/design_1_xbar_0/design_1_xbar_0/design_1_xbar_0_in_context.xdc] for cell 'design_1_i/microblaze_0_axi_periph/xbar'
Parsing XDC File [d:/aulas/cr/projects/projecto/SortWeights_5/SortWeights_5.srcs/sources_1/bd/design_1/ip/design_1_mdm_1_0/design_1_mdm_1_0/design_1_mdm_1_0_in_context.xdc] for cell 'design_1_i/mdm_1'
Finished Parsing XDC File [d:/aulas/cr/projects/projecto/SortWeights_5/SortWeights_5.srcs/sources_1/bd/design_1/ip/design_1_mdm_1_0/design_1_mdm_1_0/design_1_mdm_1_0_in_context.xdc] for cell 'design_1_i/mdm_1'
Parsing XDC File [d:/aulas/cr/projects/projecto/SortWeights_5/SortWeights_5.srcs/sources_1/bd/design_1/ip/design_1_clk_wiz_1_0/design_1_clk_wiz_1_0/design_1_clk_wiz_1_0_in_context.xdc] for cell 'design_1_i/clk_wiz_1'
Finished Parsing XDC File [d:/aulas/cr/projects/projecto/SortWeights_5/SortWeights_5.srcs/sources_1/bd/design_1/ip/design_1_clk_wiz_1_0/design_1_clk_wiz_1_0/design_1_clk_wiz_1_0_in_context.xdc] for cell 'design_1_i/clk_wiz_1'
Parsing XDC File [d:/aulas/cr/projects/projecto/SortWeights_5/SortWeights_5.srcs/sources_1/bd/design_1/ip/design_1_rst_clk_wiz_1_100M_0/design_1_rst_clk_wiz_1_100M_0/design_1_rst_clk_wiz_1_100M_0_in_context.xdc] for cell 'design_1_i/rst_clk_wiz_1_100M'
Finished Parsing XDC File [d:/aulas/cr/projects/projecto/SortWeights_5/SortWeights_5.srcs/sources_1/bd/design_1/ip/design_1_rst_clk_wiz_1_100M_0/design_1_rst_clk_wiz_1_100M_0/design_1_rst_clk_wiz_1_100M_0_in_context.xdc] for cell 'design_1_i/rst_clk_wiz_1_100M'
Parsing XDC File [d:/aulas/cr/projects/projecto/SortWeights_5/SortWeights_5.srcs/sources_1/bd/design_1/ip/design_1_axi_gpio_0_0/design_1_axi_gpio_0_0/design_1_axi_gpio_0_0_in_context.xdc] for cell 'design_1_i/axi_gpio_0'
Finished Parsing XDC File [d:/aulas/cr/projects/projecto/SortWeights_5/SortWeights_5.srcs/sources_1/bd/design_1/ip/design_1_axi_gpio_0_0/design_1_axi_gpio_0_0/design_1_axi_gpio_0_0_in_context.xdc] for cell 'design_1_i/axi_gpio_0'
Parsing XDC File [d:/aulas/cr/projects/projecto/SortWeights_5/SortWeights_5.srcs/sources_1/bd/design_1/ip/design_1_dist_mem_gen_0_0/design_1_dist_mem_gen_0_0/design_1_dist_mem_gen_0_0_in_context.xdc] for cell 'design_1_i/dist_mem_gen_0'
Finished Parsing XDC File [d:/aulas/cr/projects/projecto/SortWeights_5/SortWeights_5.srcs/sources_1/bd/design_1/ip/design_1_dist_mem_gen_0_0/design_1_dist_mem_gen_0_0/design_1_dist_mem_gen_0_0_in_context.xdc] for cell 'design_1_i/dist_mem_gen_0'
Parsing XDC File [d:/aulas/cr/projects/projecto/SortWeights_5/SortWeights_5.srcs/sources_1/bd/design_1/ip/design_1_unroll_mem_0_0/design_1_unroll_mem_0_0/design_1_unroll_mem_0_0_in_context.xdc] for cell 'design_1_i/unroll_mem_0'
Finished Parsing XDC File [d:/aulas/cr/projects/projecto/SortWeights_5/SortWeights_5.srcs/sources_1/bd/design_1/ip/design_1_unroll_mem_0_0/design_1_unroll_mem_0_0/design_1_unroll_mem_0_0_in_context.xdc] for cell 'design_1_i/unroll_mem_0'
Parsing XDC File [d:/aulas/cr/projects/projecto/SortWeights_5/SortWeights_5.srcs/sources_1/bd/design_1/ip/design_1_HammingCounter_0_0/design_1_HammingCounter_0_0/design_1_HammingCounter_0_0_in_context.xdc] for cell 'design_1_i/HammingCounter_0'
Finished Parsing XDC File [d:/aulas/cr/projects/projecto/SortWeights_5/SortWeights_5.srcs/sources_1/bd/design_1/ip/design_1_HammingCounter_0_0/design_1_HammingCounter_0_0/design_1_HammingCounter_0_0_in_context.xdc] for cell 'design_1_i/HammingCounter_0'
Parsing XDC File [d:/aulas/cr/projects/projecto/SortWeights_5/SortWeights_5.srcs/sources_1/bd/design_1/ip/design_1_IterativeSorter_0_0/design_1_IterativeSorter_0_0/design_1_IterativeSorter_0_0_in_context.xdc] for cell 'design_1_i/IterativeSorter_0'
Finished Parsing XDC File [d:/aulas/cr/projects/projecto/SortWeights_5/SortWeights_5.srcs/sources_1/bd/design_1/ip/design_1_IterativeSorter_0_0/design_1_IterativeSorter_0_0/design_1_IterativeSorter_0_0_in_context.xdc] for cell 'design_1_i/IterativeSorter_0'
Parsing XDC File [d:/aulas/cr/projects/projecto/SortWeights_5/SortWeights_5.srcs/sources_1/bd/design_1/ip/design_1_hw_to_sw_0_0/design_1_hw_to_sw_0_0/design_1_hw_to_sw_0_0_in_context.xdc] for cell 'design_1_i/hw_to_sw_0'
Finished Parsing XDC File [d:/aulas/cr/projects/projecto/SortWeights_5/SortWeights_5.srcs/sources_1/bd/design_1/ip/design_1_hw_to_sw_0_0/design_1_hw_to_sw_0_0/design_1_hw_to_sw_0_0_in_context.xdc] for cell 'design_1_i/hw_to_sw_0'
Parsing XDC File [d:/aulas/cr/projects/projecto/SortWeights_5/SortWeights_5.srcs/sources_1/bd/design_1/ip/design_1_hw_to_sw_0_1/design_1_hw_to_sw_0_1/design_1_hw_to_sw_0_1_in_context.xdc] for cell 'design_1_i/hw_to_sw_1'
Finished Parsing XDC File [d:/aulas/cr/projects/projecto/SortWeights_5/SortWeights_5.srcs/sources_1/bd/design_1/ip/design_1_hw_to_sw_0_1/design_1_hw_to_sw_0_1/design_1_hw_to_sw_0_1_in_context.xdc] for cell 'design_1_i/hw_to_sw_1'
Parsing XDC File [d:/aulas/cr/projects/projecto/SortWeights_5/SortWeights_5.srcs/sources_1/bd/design_1/ip/design_1_select_in_0_0/design_1_select_in_0_0/design_1_select_in_0_0_in_context.xdc] for cell 'design_1_i/select_in_0'
Finished Parsing XDC File [d:/aulas/cr/projects/projecto/SortWeights_5/SortWeights_5.srcs/sources_1/bd/design_1/ip/design_1_select_in_0_0/design_1_select_in_0_0/design_1_select_in_0_0_in_context.xdc] for cell 'design_1_i/select_in_0'
Parsing XDC File [d:/aulas/cr/projects/projecto/SortWeights_5/SortWeights_5.srcs/sources_1/bd/design_1/ip/design_1_select_in_0_1/design_1_select_in_0_1/design_1_select_in_0_1_in_context.xdc] for cell 'design_1_i/select_in_1'
Finished Parsing XDC File [d:/aulas/cr/projects/projecto/SortWeights_5/SortWeights_5.srcs/sources_1/bd/design_1/ip/design_1_select_in_0_1/design_1_select_in_0_1/design_1_select_in_0_1_in_context.xdc] for cell 'design_1_i/select_in_1'
Parsing XDC File [D:/aulas/cr/projects/projecto/SortWeights_5/SortWeights_5.srcs/constrs_1/imports/projects/Nexys4Alunos.xdc]
WARNING: [Vivado 12-584] No ports matched 'led[5]'. [D:/aulas/cr/projects/projecto/SortWeights_5/SortWeights_5.srcs/constrs_1/imports/projects/Nexys4Alunos.xdc:81]
WARNING: [Vivado 12-584] No ports matched 'led[5]'. [D:/aulas/cr/projects/projecto/SortWeights_5/SortWeights_5.srcs/constrs_1/imports/projects/Nexys4Alunos.xdc:82]
WARNING: [Vivado 12-584] No ports matched 'led[6]'. [D:/aulas/cr/projects/projecto/SortWeights_5/SortWeights_5.srcs/constrs_1/imports/projects/Nexys4Alunos.xdc:84]
WARNING: [Vivado 12-584] No ports matched 'led[6]'. [D:/aulas/cr/projects/projecto/SortWeights_5/SortWeights_5.srcs/constrs_1/imports/projects/Nexys4Alunos.xdc:85]
WARNING: [Vivado 12-584] No ports matched 'led[7]'. [D:/aulas/cr/projects/projecto/SortWeights_5/SortWeights_5.srcs/constrs_1/imports/projects/Nexys4Alunos.xdc:87]
WARNING: [Vivado 12-584] No ports matched 'led[7]'. [D:/aulas/cr/projects/projecto/SortWeights_5/SortWeights_5.srcs/constrs_1/imports/projects/Nexys4Alunos.xdc:88]
WARNING: [Vivado 12-584] No ports matched 'led[8]'. [D:/aulas/cr/projects/projecto/SortWeights_5/SortWeights_5.srcs/constrs_1/imports/projects/Nexys4Alunos.xdc:90]
WARNING: [Vivado 12-584] No ports matched 'led[8]'. [D:/aulas/cr/projects/projecto/SortWeights_5/SortWeights_5.srcs/constrs_1/imports/projects/Nexys4Alunos.xdc:91]
WARNING: [Vivado 12-584] No ports matched 'led[9]'. [D:/aulas/cr/projects/projecto/SortWeights_5/SortWeights_5.srcs/constrs_1/imports/projects/Nexys4Alunos.xdc:93]
WARNING: [Vivado 12-584] No ports matched 'led[9]'. [D:/aulas/cr/projects/projecto/SortWeights_5/SortWeights_5.srcs/constrs_1/imports/projects/Nexys4Alunos.xdc:94]
WARNING: [Vivado 12-584] No ports matched 'led[10]'. [D:/aulas/cr/projects/projecto/SortWeights_5/SortWeights_5.srcs/constrs_1/imports/projects/Nexys4Alunos.xdc:96]
WARNING: [Vivado 12-584] No ports matched 'led[10]'. [D:/aulas/cr/projects/projecto/SortWeights_5/SortWeights_5.srcs/constrs_1/imports/projects/Nexys4Alunos.xdc:97]
WARNING: [Vivado 12-584] No ports matched 'led[11]'. [D:/aulas/cr/projects/projecto/SortWeights_5/SortWeights_5.srcs/constrs_1/imports/projects/Nexys4Alunos.xdc:99]
WARNING: [Vivado 12-584] No ports matched 'led[11]'. [D:/aulas/cr/projects/projecto/SortWeights_5/SortWeights_5.srcs/constrs_1/imports/projects/Nexys4Alunos.xdc:100]
WARNING: [Vivado 12-584] No ports matched 'led[12]'. [D:/aulas/cr/projects/projecto/SortWeights_5/SortWeights_5.srcs/constrs_1/imports/projects/Nexys4Alunos.xdc:102]
WARNING: [Vivado 12-584] No ports matched 'led[12]'. [D:/aulas/cr/projects/projecto/SortWeights_5/SortWeights_5.srcs/constrs_1/imports/projects/Nexys4Alunos.xdc:103]
WARNING: [Vivado 12-584] No ports matched 'led[13]'. [D:/aulas/cr/projects/projecto/SortWeights_5/SortWeights_5.srcs/constrs_1/imports/projects/Nexys4Alunos.xdc:105]
WARNING: [Vivado 12-584] No ports matched 'led[13]'. [D:/aulas/cr/projects/projecto/SortWeights_5/SortWeights_5.srcs/constrs_1/imports/projects/Nexys4Alunos.xdc:106]
WARNING: [Vivado 12-584] No ports matched 'led[14]'. [D:/aulas/cr/projects/projecto/SortWeights_5/SortWeights_5.srcs/constrs_1/imports/projects/Nexys4Alunos.xdc:108]
WARNING: [Vivado 12-584] No ports matched 'led[14]'. [D:/aulas/cr/projects/projecto/SortWeights_5/SortWeights_5.srcs/constrs_1/imports/projects/Nexys4Alunos.xdc:109]
WARNING: [Vivado 12-584] No ports matched 'led[15]'. [D:/aulas/cr/projects/projecto/SortWeights_5/SortWeights_5.srcs/constrs_1/imports/projects/Nexys4Alunos.xdc:111]
WARNING: [Vivado 12-584] No ports matched 'led[15]'. [D:/aulas/cr/projects/projecto/SortWeights_5/SortWeights_5.srcs/constrs_1/imports/projects/Nexys4Alunos.xdc:112]
WARNING: [Vivado 12-584] No ports matched 'btnC'. [D:/aulas/cr/projects/projecto/SortWeights_5/SortWeights_5.srcs/constrs_1/imports/projects/Nexys4Alunos.xdc:194]
WARNING: [Vivado 12-584] No ports matched 'btnC'. [D:/aulas/cr/projects/projecto/SortWeights_5/SortWeights_5.srcs/constrs_1/imports/projects/Nexys4Alunos.xdc:195]
WARNING: [Vivado 12-584] No ports matched 'btnU'. [D:/aulas/cr/projects/projecto/SortWeights_5/SortWeights_5.srcs/constrs_1/imports/projects/Nexys4Alunos.xdc:197]
WARNING: [Vivado 12-584] No ports matched 'btnU'. [D:/aulas/cr/projects/projecto/SortWeights_5/SortWeights_5.srcs/constrs_1/imports/projects/Nexys4Alunos.xdc:198]
WARNING: [Vivado 12-584] No ports matched 'btnL'. [D:/aulas/cr/projects/projecto/SortWeights_5/SortWeights_5.srcs/constrs_1/imports/projects/Nexys4Alunos.xdc:200]
WARNING: [Vivado 12-584] No ports matched 'btnL'. [D:/aulas/cr/projects/projecto/SortWeights_5/SortWeights_5.srcs/constrs_1/imports/projects/Nexys4Alunos.xdc:201]
WARNING: [Vivado 12-584] No ports matched 'btnR'. [D:/aulas/cr/projects/projecto/SortWeights_5/SortWeights_5.srcs/constrs_1/imports/projects/Nexys4Alunos.xdc:203]
WARNING: [Vivado 12-584] No ports matched 'btnR'. [D:/aulas/cr/projects/projecto/SortWeights_5/SortWeights_5.srcs/constrs_1/imports/projects/Nexys4Alunos.xdc:204]
WARNING: [Vivado 12-584] No ports matched 'btnD'. [D:/aulas/cr/projects/projecto/SortWeights_5/SortWeights_5.srcs/constrs_1/imports/projects/Nexys4Alunos.xdc:206]
WARNING: [Vivado 12-584] No ports matched 'btnD'. [D:/aulas/cr/projects/projecto/SortWeights_5/SortWeights_5.srcs/constrs_1/imports/projects/Nexys4Alunos.xdc:207]
Finished Parsing XDC File [D:/aulas/cr/projects/projecto/SortWeights_5/SortWeights_5.srcs/constrs_1/imports/projects/Nexys4Alunos.xdc]
WARNING: [Project 1-498] One or more constraints failed evaluation while reading constraint file [D:/aulas/cr/projects/projecto/SortWeights_5/SortWeights_5.srcs/constrs_1/imports/projects/Nexys4Alunos.xdc] and the design contains unresolved black boxes. These constraints will be read post-synthesis (as long as their source constraint file is marked as used_in_implementation) and should be applied correctly then. You should review the constraints listed in the file [.Xil/design_1_wrapper_propImpl.xdc] and check the run log file to verify that these constraints were correctly applied.
INFO: [Project 1-236] Implementation specific constraints were found while reading constraint file [D:/aulas/cr/projects/projecto/SortWeights_5/SortWeights_5.srcs/constrs_1/imports/projects/Nexys4Alunos.xdc]. These constraints will be ignored for synthesis but will be used in implementation. Impacted constraints are listed in the file [.Xil/design_1_wrapper_propImpl.xdc].
Resolution: To avoid this warning, move constraints listed in [.Xil/design_1_wrapper_propImpl.xdc] to another XDC file and exclude this new file from synthesis with the used_in_synthesis property (File Properties dialog in GUI) and re-run elaboration/synthesis.
Parsing XDC File [D:/aulas/cr/projects/projecto/SortWeights_5/SortWeights_5.runs/synth_1/dont_touch.xdc]
Finished Parsing XDC File [D:/aulas/cr/projects/projecto/SortWeights_5/SortWeights_5.runs/synth_1/dont_touch.xdc]
Netlist sorting complete. Time (s): cpu = 00:00:00 ; elapsed = 00:00:00 . Memory (MB): peak = 881.727 ; gain = 0.000
Completed Processing XDC Constraints

Netlist sorting complete. Time (s): cpu = 00:00:00 ; elapsed = 00:00:00 . Memory (MB): peak = 881.727 ; gain = 0.000
INFO: [Project 1-111] Unisim Transformation Summary:
No Unisim elements were transformed.

Netlist sorting complete. Time (s): cpu = 00:00:00 ; elapsed = 00:00:00 . Memory (MB): peak = 881.727 ; gain = 0.000
Constraint Validation Runtime : Time (s): cpu = 00:00:00 ; elapsed = 00:00:00.032 . Memory (MB): peak = 881.727 ; gain = 0.000
WARNING: [Timing 38-316] Clock period '20.000' specified during out-of-context synthesis of instance 'design_1_i/dist_mem_gen_0' at clock pin 'clk' is different from the actual clock period '10.000', this can lead to different synthesis results.
WARNING: [Timing 38-316] Clock period '20.000' specified during out-of-context synthesis of instance 'design_1_i/microblaze_0_local_memory/lmb_bram' at clock pin 'clka' is different from the actual clock period '10.000', this can lead to different synthesis results.
---------------------------------------------------------------------------------
Finished Constraint Validation : Time (s): cpu = 00:00:20 ; elapsed = 00:00:26 . Memory (MB): peak = 881.727 ; gain = 489.879
---------------------------------------------------------------------------------
---------------------------------------------------------------------------------
Start Loading Part and Timing Information
---------------------------------------------------------------------------------
Loading part: xc7a100tcsg324-1
---------------------------------------------------------------------------------
Finished Loading Part and Timing Information : Time (s): cpu = 00:00:20 ; elapsed = 00:00:26 . Memory (MB): peak = 881.727 ; gain = 489.879
---------------------------------------------------------------------------------
---------------------------------------------------------------------------------
Start Applying 'set_property' XDC Constraints
---------------------------------------------------------------------------------
Applied set_property IO_BUFFER_TYPE = NONE for clk. (constraint file  d:/aulas/cr/projects/projecto/SortWeights_5/SortWeights_5.srcs/sources_1/bd/design_1/ip/design_1_clk_wiz_1_0/design_1_clk_wiz_1_0/design_1_clk_wiz_1_0_in_context.xdc, line 3).
Applied set_property CLOCK_BUFFER_TYPE = NONE for clk. (constraint file  d:/aulas/cr/projects/projecto/SortWeights_5/SortWeights_5.srcs/sources_1/bd/design_1/ip/design_1_clk_wiz_1_0/design_1_clk_wiz_1_0/design_1_clk_wiz_1_0_in_context.xdc, line 4).
Applied set_property DONT_TOUCH = true for design_1_i. (constraint file  auto generated constraint, line ).
Applied set_property DONT_TOUCH = true for design_1_i/microblaze_0. (constraint file  auto generated constraint, line ).
Applied set_property DONT_TOUCH = true for design_1_i/microblaze_0_local_memory/dlmb_v10. (constraint file  auto generated constraint, line ).
Applied set_property DONT_TOUCH = true for design_1_i/microblaze_0_local_memory/ilmb_v10. (constraint file  auto generated constraint, line ).
Applied set_property DONT_TOUCH = true for design_1_i/microblaze_0_local_memory/dlmb_bram_if_cntlr. (constraint file  auto generated constraint, line ).
Applied set_property DONT_TOUCH = true for design_1_i/microblaze_0_local_memory/ilmb_bram_if_cntlr. (constraint file  auto generated constraint, line ).
Applied set_property DONT_TOUCH = true for design_1_i/microblaze_0_local_memory/lmb_bram. (constraint file  auto generated constraint, line ).
Applied set_property DONT_TOUCH = true for design_1_i/microblaze_0_axi_periph/xbar. (constraint file  auto generated constraint, line ).
Applied set_property DONT_TOUCH = true for design_1_i/microblaze_0_axi_periph. (constraint file  auto generated constraint, line ).
Applied set_property DONT_TOUCH = true for design_1_i/mdm_1. (constraint file  auto generated constraint, line ).
Applied set_property DONT_TOUCH = true for design_1_i/clk_wiz_1. (constraint file  auto generated constraint, line ).
Applied set_property DONT_TOUCH = true for design_1_i/rst_clk_wiz_1_100M. (constraint file  auto generated constraint, line ).
Applied set_property DONT_TOUCH = true for design_1_i/axi_gpio_0. (constraint file  auto generated constraint, line ).
Applied set_property DONT_TOUCH = true for design_1_i/dist_mem_gen_0. (constraint file  auto generated constraint, line ).
Applied set_property DONT_TOUCH = true for design_1_i/xlslice_0. (constraint file  auto generated constraint, line ).
Applied set_property DONT_TOUCH = true for design_1_i/xlslice_1. (constraint file  auto generated constraint, line ).
Applied set_property DONT_TOUCH = true for design_1_i/xlslice_2. (constraint file  auto generated constraint, line ).
Applied set_property DONT_TOUCH = true for design_1_i/xlslice_3. (constraint file  auto generated constraint, line ).
Applied set_property DONT_TOUCH = true for design_1_i/xlslice_4. (constraint file  auto generated constraint, line ).
Applied set_property DONT_TOUCH = true for design_1_i/unroll_mem_0. (constraint file  auto generated constraint, line ).
Applied set_property DONT_TOUCH = true for design_1_i/HammingCounter_0. (constraint file  auto generated constraint, line ).
Applied set_property DONT_TOUCH = true for design_1_i/IterativeSorter_0. (constraint file  auto generated constraint, line ).
Applied set_property DONT_TOUCH = true for design_1_i/xlslice_5. (constraint file  auto generated constraint, line ).
Applied set_property DONT_TOUCH = true for design_1_i/xlslice_6. (constraint file  auto generated constraint, line ).
Applied set_property DONT_TOUCH = true for design_1_i/hw_to_sw_0. (constraint file  auto generated constraint, line ).
Applied set_property DONT_TOUCH = true for design_1_i/hw_to_sw_1. (constraint file  auto generated constraint, line ).
Applied set_property DONT_TOUCH = true for design_1_i/select_in_0. (constraint file  auto generated constraint, line ).
Applied set_property DONT_TOUCH = true for design_1_i/select_in_1. (constraint file  auto generated constraint, line ).
Applied set_property DONT_TOUCH = true for design_1_i/xlslice_7. (constraint file  auto generated constraint, line ).
Applied set_property DONT_TOUCH = true for design_1_i/xlslice_8. (constraint file  auto generated constraint, line ).
---------------------------------------------------------------------------------
Finished applying 'set_property' XDC Constraints : Time (s): cpu = 00:00:21 ; elapsed = 00:00:26 . Memory (MB): peak = 881.727 ; gain = 489.879
---------------------------------------------------------------------------------
---------------------------------------------------------------------------------
Finished RTL Optimization Phase 2 : Time (s): cpu = 00:00:21 ; elapsed = 00:00:26 . Memory (MB): peak = 881.727 ; gain = 489.879
---------------------------------------------------------------------------------

Report RTL Partitions: 
+-+--------------+------------+----------+
| |RTL Partition |Replication |Instances |
+-+--------------+------------+----------+
+-+--------------+------------+----------+
---------------------------------------------------------------------------------
Start RTL Component Statistics 
---------------------------------------------------------------------------------
Detailed RTL Component Info : 
---------------------------------------------------------------------------------
Finished RTL Component Statistics 
---------------------------------------------------------------------------------
---------------------------------------------------------------------------------
Start RTL Hierarchical Component Statistics 
---------------------------------------------------------------------------------
Hierarchical RTL Component report 
---------------------------------------------------------------------------------
Finished RTL Hierarchical Component Statistics
---------------------------------------------------------------------------------
---------------------------------------------------------------------------------
Start Part Resource Summary
---------------------------------------------------------------------------------
Part Resources:
DSPs: 240 (col length:80)
BRAMs: 270 (col length: RAMB18 80 RAMB36 40)
---------------------------------------------------------------------------------
Finished Part Resource Summary
---------------------------------------------------------------------------------
---------------------------------------------------------------------------------
Start Cross Boundary and Area Optimization
---------------------------------------------------------------------------------
Warning: Parallel synthesis criteria is not met 
---------------------------------------------------------------------------------
Finished Cross Boundary and Area Optimization : Time (s): cpu = 00:00:22 ; elapsed = 00:00:28 . Memory (MB): peak = 881.727 ; gain = 489.879
---------------------------------------------------------------------------------

Report RTL Partitions: 
+-+--------------+------------+----------+
| |RTL Partition |Replication |Instances |
+-+--------------+------------+----------+
+-+--------------+------------+----------+
---------------------------------------------------------------------------------
Start Applying XDC Timing Constraints
---------------------------------------------------------------------------------
INFO: [Synth 8-5578] Moved timing constraint from pin 'design_1_i/microblaze_0_local_memory/dlmb_bram_if_cntlr/BRAM_Clk_A' to pin 'design_1_i/microblaze_0_local_memory/dlmb_bram_if_cntlr/bbstub_BRAM_Clk_A/O'
INFO: [Synth 8-5578] Moved timing constraint from pin 'design_1_i/microblaze_0_local_memory/ilmb_bram_if_cntlr/BRAM_Clk_A' to pin 'design_1_i/microblaze_0_local_memory/ilmb_bram_if_cntlr/bbstub_BRAM_Clk_A/O'
INFO: [Synth 8-5578] Moved timing constraint from pin 'design_1_i/mdm_1/Dbg_Clk_0' to pin 'design_1_i/mdm_1/bbstub_Dbg_Clk_0/O'
INFO: [Synth 8-5578] Moved timing constraint from pin 'design_1_i/mdm_1/Dbg_Update_0' to pin 'design_1_i/mdm_1/bbstub_Dbg_Update_0/O'
INFO: [Synth 8-5578] Moved timing constraint from pin 'design_1_i/clk_wiz_1/clk_out1' to pin 'design_1_i/clk_wiz_1/bbstub_clk_out1/O'
INFO: [Synth 8-5819] Moved 5 constraints on hierarchical pins to their respective driving/loading pins
---------------------------------------------------------------------------------
Finished Applying XDC Timing Constraints : Time (s): cpu = 00:00:35 ; elapsed = 00:00:41 . Memory (MB): peak = 881.727 ; gain = 489.879
---------------------------------------------------------------------------------
---------------------------------------------------------------------------------
Start Timing Optimization
---------------------------------------------------------------------------------
---------------------------------------------------------------------------------
Finished Timing Optimization : Time (s): cpu = 00:00:35 ; elapsed = 00:00:41 . Memory (MB): peak = 881.727 ; gain = 489.879
---------------------------------------------------------------------------------

Report RTL Partitions: 
+-+--------------+------------+----------+
| |RTL Partition |Replication |Instances |
+-+--------------+------------+----------+
+-+--------------+------------+----------+
---------------------------------------------------------------------------------
Start Technology Mapping
---------------------------------------------------------------------------------
---------------------------------------------------------------------------------
Finished Technology Mapping : Time (s): cpu = 00:00:36 ; elapsed = 00:00:42 . Memory (MB): peak = 892.996 ; gain = 501.148
---------------------------------------------------------------------------------

Report RTL Partitions: 
+-+--------------+------------+----------+
| |RTL Partition |Replication |Instances |
+-+--------------+------------+----------+
+-+--------------+------------+----------+
---------------------------------------------------------------------------------
Start IO Insertion
---------------------------------------------------------------------------------
---------------------------------------------------------------------------------
Start Flattening Before IO Insertion
---------------------------------------------------------------------------------
---------------------------------------------------------------------------------
Finished Flattening Before IO Insertion
---------------------------------------------------------------------------------
---------------------------------------------------------------------------------
Start Final Netlist Cleanup
---------------------------------------------------------------------------------
---------------------------------------------------------------------------------
Finished Final Netlist Cleanup
---------------------------------------------------------------------------------
---------------------------------------------------------------------------------
Finished IO Insertion : Time (s): cpu = 00:00:38 ; elapsed = 00:00:45 . Memory (MB): peak = 892.996 ; gain = 501.148
---------------------------------------------------------------------------------

Report Check Netlist: 
+------+------------------+-------+---------+-------+------------------+
|      |Item              |Errors |Warnings |Status |Description       |
+------+------------------+-------+---------+-------+------------------+
|1     |multi_driven_nets |      0|        0|Passed |Multi driven nets |
+------+------------------+-------+---------+-------+------------------+
---------------------------------------------------------------------------------
Start Renaming Generated Instances
---------------------------------------------------------------------------------
---------------------------------------------------------------------------------
Finished Renaming Generated Instances : Time (s): cpu = 00:00:38 ; elapsed = 00:00:45 . Memory (MB): peak = 892.996 ; gain = 501.148
---------------------------------------------------------------------------------

Report RTL Partitions: 
+-+--------------+------------+----------+
| |RTL Partition |Replication |Instances |
+-+--------------+------------+----------+
+-+--------------+------------+----------+
---------------------------------------------------------------------------------
Start Rebuilding User Hierarchy
---------------------------------------------------------------------------------
---------------------------------------------------------------------------------
Finished Rebuilding User Hierarchy : Time (s): cpu = 00:00:38 ; elapsed = 00:00:45 . Memory (MB): peak = 892.996 ; gain = 501.148
---------------------------------------------------------------------------------
---------------------------------------------------------------------------------
Start Renaming Generated Ports
---------------------------------------------------------------------------------
---------------------------------------------------------------------------------
Finished Renaming Generated Ports : Time (s): cpu = 00:00:38 ; elapsed = 00:00:45 . Memory (MB): peak = 892.996 ; gain = 501.148
---------------------------------------------------------------------------------
---------------------------------------------------------------------------------
Start Handling Custom Attributes
---------------------------------------------------------------------------------
---------------------------------------------------------------------------------
Finished Handling Custom Attributes : Time (s): cpu = 00:00:38 ; elapsed = 00:00:45 . Memory (MB): peak = 892.996 ; gain = 501.148
---------------------------------------------------------------------------------
---------------------------------------------------------------------------------
Start Renaming Generated Nets
---------------------------------------------------------------------------------
---------------------------------------------------------------------------------
Finished Renaming Generated Nets : Time (s): cpu = 00:00:38 ; elapsed = 00:00:45 . Memory (MB): peak = 892.996 ; gain = 501.148
---------------------------------------------------------------------------------
---------------------------------------------------------------------------------
Start Writing Synthesis Report
---------------------------------------------------------------------------------

Report BlackBoxes: 
+------+------------------------------+----------+
|      |BlackBox name                 |Instances |
+------+------------------------------+----------+
|1     |design_1_xbar_0               |         1|
|2     |design_1_HammingCounter_0_0   |         1|
|3     |design_1_IterativeSorter_0_0  |         1|
|4     |design_1_axi_gpio_0_0         |         1|
|5     |design_1_clk_wiz_1_0          |         1|
|6     |design_1_dist_mem_gen_0_0     |         1|
|7     |design_1_hw_to_sw_0_0         |         1|
|8     |design_1_hw_to_sw_0_1         |         1|
|9     |design_1_mdm_1_0              |         1|
|10    |design_1_microblaze_0_0       |         1|
|11    |design_1_rst_clk_wiz_1_100M_0 |         1|
|12    |design_1_select_in_0_0        |         1|
|13    |design_1_select_in_0_1        |         1|
|14    |design_1_unroll_mem_0_0       |         1|
|15    |design_1_dlmb_bram_if_cntlr_0 |         1|
|16    |design_1_dlmb_v10_0           |         1|
|17    |design_1_ilmb_bram_if_cntlr_0 |         1|
|18    |design_1_ilmb_v10_0           |         1|
|19    |design_1_lmb_bram_0           |         1|
+------+------------------------------+----------+

Report Cell Usage: 
+------+--------------------------------------+------+
|      |Cell                                  |Count |
+------+--------------------------------------+------+
|1     |design_1_HammingCounter_0_0_bbox_0    |     1|
|2     |design_1_IterativeSorter_0_0_bbox_1   |     1|
|3     |design_1_axi_gpio_0_0_bbox_2          |     1|
|4     |design_1_clk_wiz_1_0_bbox_3           |     1|
|5     |design_1_dist_mem_gen_0_0_bbox_4      |     1|
|6     |design_1_dlmb_bram_if_cntlr_0_bbox_10 |     1|
|7     |design_1_dlmb_v10_0_bbox_11           |     1|
|8     |design_1_hw_to_sw_0_0_bbox_5          |     1|
|9     |design_1_hw_to_sw_0_1_bbox_6          |     1|
|10    |design_1_ilmb_bram_if_cntlr_0_bbox_12 |     1|
|11    |design_1_ilmb_v10_0_bbox_13           |     1|
|12    |design_1_lmb_bram_0_bbox_14           |     1|
|13    |design_1_mdm_1_0_bbox_7               |     1|
|14    |design_1_microblaze_0_0_bbox_8        |     1|
|15    |design_1_rst_clk_wiz_1_100M_0_bbox_15 |     1|
|16    |design_1_select_in_0_0_bbox_16        |     1|
|17    |design_1_select_in_0_1_bbox_17        |     1|
|18    |design_1_unroll_mem_0_0_bbox_18       |     1|
|19    |design_1_xbar_0_bbox_9                |     1|
|20    |IBUF                                  |     1|
|21    |OBUF                                  |     5|
+------+--------------------------------------+------+

Report Instance Areas: 
+------+------------------------------+--------------------------------------+------+
|      |Instance                      |Module                                |Cells |
+------+------------------------------+--------------------------------------+------+
|1     |top                           |                                      |  5306|
|2     |  design_1_i                  |design_1                              |  5300|
|3     |    microblaze_0_axi_periph   |design_1_microblaze_0_axi_periph_0    |   263|
|4     |    xlslice_0                 |design_1_xlslice_0_0                  |     0|
|5     |    xlslice_1                 |design_1_xlslice_1_0                  |     0|
|6     |    xlslice_2                 |design_1_xlslice_2_0                  |     0|
|7     |    xlslice_3                 |design_1_xlslice_3_0                  |     0|
|8     |    xlslice_4                 |design_1_xlslice_4_0                  |     0|
|9     |    xlslice_5                 |design_1_xlslice_5_0                  |     0|
|10    |    xlslice_6                 |design_1_xlslice_6_0                  |     0|
|11    |    xlslice_7                 |design_1_xlslice_7_1                  |     0|
|12    |    xlslice_8                 |design_1_xlslice_8_0                  |     0|
|13    |    microblaze_0_local_memory |microblaze_0_local_memory_imp_1K0VQXK |   496|
+------+------------------------------+--------------------------------------+------+
---------------------------------------------------------------------------------
Finished Writing Synthesis Report : Time (s): cpu = 00:00:38 ; elapsed = 00:00:45 . Memory (MB): peak = 892.996 ; gain = 501.148
---------------------------------------------------------------------------------
Synthesis finished with 0 errors, 0 critical warnings and 1269 warnings.
Synthesis Optimization Runtime : Time (s): cpu = 00:00:23 ; elapsed = 00:00:32 . Memory (MB): peak = 892.996 ; gain = 175.180
Synthesis Optimization Complete : Time (s): cpu = 00:00:39 ; elapsed = 00:00:45 . Memory (MB): peak = 892.996 ; gain = 501.148
INFO: [Project 1-571] Translating synthesized netlist
INFO: [Project 1-570] Preparing netlist for logic optimization
INFO: [Opt 31-138] Pushed 0 inverter(s) to 0 load pin(s).
Netlist sorting complete. Time (s): cpu = 00:00:00 ; elapsed = 00:00:00 . Memory (MB): peak = 903.953 ; gain = 0.000
INFO: [Project 1-111] Unisim Transformation Summary:
No Unisim elements were transformed.

INFO: [Common 17-83] Releasing license: Synthesis
118 Infos, 135 Warnings, 0 Critical Warnings and 0 Errors encountered.
synth_design completed successfully
synth_design: Time (s): cpu = 00:00:42 ; elapsed = 00:00:50 . Memory (MB): peak = 903.957 ; gain = 520.105
Netlist sorting complete. Time (s): cpu = 00:00:00 ; elapsed = 00:00:00 . Memory (MB): peak = 904.020 ; gain = 0.000
WARNING: [Constraints 18-5210] No constraints selected for write.
Resolution: This message can indicate that there are no constraints for the design, or it can indicate that the used_in flags are set such that the constraints are ignored. This later case is used when running synth_design to not write synthesis constraints to the resulting checkpoint. Instead, project constraints are read when the synthesized design is opened.
INFO: [Common 17-1381] The checkpoint 'D:/aulas/cr/projects/projecto/SortWeights_5/SortWeights_5.runs/synth_1/design_1_wrapper.dcp' has been generated.
INFO: [runtcl-4] Executing : report_utilization -file design_1_wrapper_utilization_synth.rpt -pb design_1_wrapper_utilization_synth.pb
INFO: [Common 17-206] Exiting Vivado at Thu May 30 20:13:03 2019...
